id_offer,ean,locale,category,title,short_description,description,manufacturer,picture_1,picture_2,picture_3,picture_4,price_cs,quantity,condition,length,width,height,weight,content_volume,currency,handling_time,delivery_time_max,delivery_time_min
S0384805,0194900274446,cs-CZ,Gardening & DIY,Dámská Taška Michael Kors 35S1GTTC7L-POWDER-BLUSH Růžový 24 x 18 x 6 cm,Chcete držet krok s módou a máte rádi drobné doplňky? Přinášíme vám <b>Dámská Taška Michael Kors 35S1GTTC7L-POWDER-BLUSH Růžový 24 x 18 x 6 cm</b> a š,Chcete držet krok s módou a máte rádi drobné doplňky? Přinášíme vám <b>Dámská Taška Michael Kors 35S1GTTC7L-POWDER-BLUSH Růžový 24 x 18 x 6 cm</b> a široký výběr trendy kabelek a peněženek!<br><br><ul><li>Pohlaví: Dáma</li><li>Typ: Dámská Taška</li><li>Barva: Růžový</li><li>Materiál: Plátno</li><li>Typ zapínání: zip</li><li>Obsahuje: Obsahuje pouzdro nebo kryt značky</li><li>Přibližné rozměry: 24 x 18 x 6 cm</li></ul>,Pop Pulse Emporium,https://cdnbigbuy.com/images/0194900274446_S0384805_P00.jpg,https://cdnbigbuy.com/images/0194900274446_S0384805_P10.jpg,https://cdnbigbuy.com/images/0194900274446_S0384805_P20.jpg,,4594.05,5,NEW,25.0,25.0,7.0,0.4,4375.0,CZK,2,5,3
S72104471,8430622829871,cs-CZ,Gardening & DIY,Pánské hodinky Lotus 18969/2,"Pokud sledujete trendy v oblasti módy a doplňků, nakupujte <b>Pánské hodinky Lotus 18969/2</b> za nejlepší ceny.<br><br><ul><li>Pohlaví: <ul><li>Pánsk","Pokud sledujete trendy v oblasti módy a doplňků, nakupujte <b>Pánské hodinky Lotus 18969/2</b> za nejlepší ceny.<br><br><ul><li>Pohlaví: <ul><li>Pánský</li><li>Dáma</li></ul></li><li>Další odkazy: Č.</li><li>Typ hodinek: Náramkové hodinky</li><li>Materiál pásku: Nerezová ocel</li><li>Barva řemínku: Vícebarevný</li><li>Typ pohybu: Křemen</li></ul>",Pop Pulse Emporium,https://cdnbigbuy.com/images/8430622829871_R00.jpg,https://cdnbigbuy.com/images/103483_mandatory-watch0.jpg,,,3929.08,50,NEW,14.15,12.43,10.11,0.3,1778.19,CZK,2,5,3
S0387828,0197853077720,cs-CZ,Gardening & DIY,"Taška přes rameno Michael Kors 35F4GTVC1B-BROWN Kaštanová 21 x 14 x 4,5 cm","Pokud hledáte nejnovější trendy na trhu, máme tu čest vám představit <b>Taška přes rameno Michael Kors 35F4GTVC1B-BROWN Kaštanová 21 x 14 x 4,5 cm</b>","Pokud hledáte nejnovější trendy na trhu, máme tu čest vám představit <b>Taška přes rameno Michael Kors 35F4GTVC1B-BROWN Kaštanová 21 x 14 x 4,5 cm</b>!<br><br><ul><li>Pohlaví: Dáma</li><li>Typ: Taška přes rameno</li><li>Barva: Kaštanová</li><li>Složení: Kůže</li><li>Typ zapínání: Magnetický</li><li>Obsahuje: Obsahuje pouzdro nebo kryt značky</li><li>Přibližné rozměry: 21 x 14 x 4,5 cm</li></ul>",Pop Pulse Emporium,https://cdnbigbuy.com/images/S0387828_1733921400-remove-background0.jpg,https://cdnbigbuy.com/images/0197853077720_S0387828_P10.jpg,https://cdnbigbuy.com/images/0197853077720_S0387828_P00.jpg,,4038.32,10,NEW,10.0,10.0,10.0,0.3,1000.0,CZK,2,5,3
S0389692,0197853277472,cs-CZ,Gardening & DIY,Taška přes rameno Michael Kors 35F4STVC1L-PEARL-GREY Šedý 21 x 12 x 5 cm,"Pokud hledáte nejnovější trendy na trhu, máme tu čest vám představit <b>Taška přes rameno Michael Kors 35F4STVC1L-PEARL-GREY Šedý 21 x 12 x 5 cm</b>!<","Pokud hledáte nejnovější trendy na trhu, máme tu čest vám představit <b>Taška přes rameno Michael Kors 35F4STVC1L-PEARL-GREY Šedý 21 x 12 x 5 cm</b>!<br><br><ul><li>Typ: Taška přes rameno</li><li>Barva: Šedý</li><li>Složení: Kůže</li><li>Typ zapínání: click</li><li>Obsahuje: Obsahuje pouzdro nebo kryt značky</li><li>Přibližné rozměry: 21 x 12 x 5 cm</li></ul>",Pop Pulse Emporium,https://cdnbigbuy.com/images/0197853277472_S0389692_P00.jpg,https://cdnbigbuy.com/images/0197853277472_S0389692_P10.jpg,https://cdnbigbuy.com/images/0197853277472_S0389692_P20.jpg,,4038.32,10,NEW,10.0,10.0,10.0,0.3,1000.0,CZK,2,5,3
S0389518,0196237627186,cs-CZ,Gardening & DIY,Taška přes rameno Michael Kors 35S4GTVC5L-LT-CREAM Béžový 22 x 20 x 7 cm,"Pokud hledáte nejnovější trendy na trhu, máme tu čest vám představit <b>Taška přes rameno Michael Kors 35S4GTVC5L-LT-CREAM Béžový 22 x 20 x 7 cm</b>!<","Pokud hledáte nejnovější trendy na trhu, máme tu čest vám představit <b>Taška přes rameno Michael Kors 35S4GTVC5L-LT-CREAM Béžový 22 x 20 x 7 cm</b>!<br><br><ul><li>Typ: Taška přes rameno</li><li>Barva: Béžový</li><li>Materiál: Plátno</li><li>Typ zapínání: zip</li><li>Obsahuje: Obsahuje pouzdro nebo kryt značky</li><li>Přibližné rozměry: 22 x 20 x 7 cm</li></ul>",Pop Pulse Emporium,https://cdnbigbuy.com/images/0196237627186_S0389518_P00.jpg,https://cdnbigbuy.com/images/0196237627186_S0389518_P10.jpg,https://cdnbigbuy.com/images/0196237627186_S0389518_P20.jpg,,3478.4,23,NEW,10.0,10.0,10.0,0.3,1000.0,CZK,2,5,3
S4310370,8412688557202,cs-CZ,Gardening & DIY,Sada zavazadel F.C. Barcelona + mediano 24 Vozík Černý 40 x 63 x 26 cm (2 Kusy),Chcete držet krok s módou a máte rádi drobné doplňky? Přinášíme vám <b>Sada zavazadel F.C. Barcelona + mediano 24 Vozík Černý 40 x 63 x 26 cm (2 Kusy),"Chcete držet krok s módou a máte rádi drobné doplňky? Přinášíme vám <b>Sada zavazadel F.C. Barcelona + mediano 24 Vozík Černý 40 x 63 x 26 cm (2 Kusy)</b> a široký výběr trendy kabelek a peněženek!<br><br><ul><li>Typ: Vozík</li><li>velikost: <ul><li>24""</li><li>20''</li></ul></li><li>Materiál: <ul><li>Polykarbonát</li><li>ABS</li></ul></li><li>Barva: Černý</li><li>Počet kusů: 2 Kusy</li><li>Přibližné rozměry: 40 x 63 x 26 cm</li></ul>",Pop Pulse Emporium,https://cdnbigbuy.com/images/8412688557202_S4310370_P00.jpg,,,,4200.47,50,NEW,3.0,40.0,63.0,6.0,7560.0,CZK,2,5,3
S72126078,0726644113608,cs-CZ,Gardening & DIY,Pánské sluneční brýle Serengeti SS571002,"Pokud hledáte nejnovější trendy na trhu, máme tu čest vám představit <b>Pánské sluneční brýle Serengeti SS571002</b>!<br><br><ul><li>Typ: Pánské slune","Pokud hledáte nejnovější trendy na trhu, máme tu čest vám představit <b>Pánské sluneční brýle Serengeti SS571002</b>!<br><br><ul><li>Typ: Pánské sluneční brýle</li><li>ochrana: 100% ochrana proti UV záření (UV400)</li><li>Pohlaví: Pánský</li></ul>",Pop Pulse Emporium,https://cdnbigbuy.com/images/0726644113608_S72126078_P00.jpg,https://cdnbigbuy.com/images/0726644113608_S72126078_P10.jpg,https://cdnbigbuy.com/images/0726644113608_S72126078_P20.jpg,,3755.5,22,NEW,10.0,10.0,10.06,0.28,1006.0,CZK,2,5,3
S0386169,0196237345417,cs-CZ,Gardening & DIY,Dámská Taška Michael Kors ASTOR,Chcete držet krok s módou a máte rádi drobné doplňky? Přinášíme vám <b>Dámská Taška Michael Kors ASTOR</b> a široký výběr trendy kabelek a peněženek!<,Chcete držet krok s módou a máte rádi drobné doplňky? Přinášíme vám <b>Dámská Taška Michael Kors ASTOR</b> a široký výběr trendy kabelek a peněženek!<br><br><ul><li>Typ: Dámská Taška</li><li>Pohlaví: Dáma</li><li>Barva: Růžový</li><li>Složení: Kůže</li><li>Typ zapínání: zip</li><li>Obsahuje: Obsahuje pouzdro nebo kryt značky</li><li>Přibližné rozměry: 28 x 16 x 7 cm</li></ul>,Pop Pulse Emporium,https://cdnbigbuy.com/images/0196237345417_S0386169_P00.jpg,https://cdnbigbuy.com/images/0196237345417_S0386169_P10.jpg,https://cdnbigbuy.com/images/0196237345417_S0386169_P20.jpg,,4038.32,1,NEW,20.0,30.0,10.0,0.3,6000.0,CZK,2,5,3
M0513523,0632983075173,cs-CZ,Gardening & DIY,Originální toner Kyocera TK-5440C Azurová,Vracejte se do kanceláře bez zapomenutí jediné věci! Nakupujte <b>Originální toner Kyocera TK-5440C Azurová</b> a nechte kolegy závidět!<br><br><ul><l,Vracejte se do kanceláře bez zapomenutí jediné věci! Nakupujte <b>Originální toner Kyocera TK-5440C Azurová</b> a nechte kolegy závidět!<br><br><ul><li>Barva: Azurová</li><li>Velikost: XL</li><li>Vlastnosti: Originální</li></ul>,Pop Pulse Emporium,https://cdnbigbuy.com/images/0632983075173_R00.jpg,,,,3501.62,25,NEW,19.5,9.5,8.5,0.19,1574.62,CZK,2,5,3
S7253004,8054704419073,cs-CZ,Gardening & DIY,Pánský náramek Albert M. WSOX00448.S,"Představuje se vám <b>Pánský náramek Albert M. WSOX00448.S</b> a široký výběr prstýnků, náramků, náhrdelníků, náušnic za skvělou cenu. Získejte podrob","Představuje se vám <b>Pánský náramek Albert M. WSOX00448.S</b> a široký výběr prstýnků, náramků, náhrdelníků, náušnic za skvělou cenu. Získejte podrobné informace o exkluzivních elegantních špercích a bižuterii v různých stylech, z nichž si vybere každý.<br><br><ul><li>Typ: <ul><li>Náramek</li><li>Pánský náramek</li></ul></li><li>Pohlaví: Pánský</li></ul>",Pop Pulse Emporium,https://cdnbigbuy.com/images/8054704419073_S7253004_P01.jpg,https://cdnbigbuy.com/images/8054704419073_S7253004_P11.jpg,,,4408.3,2,NEW,9.99,9.99,9.96,0.3,994.01,CZK,2,5,3
S71017372,8719514491649,cs-CZ,Gardening & DIY,Led baterka Philips Bílý G 400 lm 2 kusů (6500 K),"Pokud hledáte nejnovější trendy na trhu, máme tu čest vám představit <b>Led baterka Philips Bílý G 400 lm 2 kusů (6500 K)</b>!<br><br><ul><li>Typ: <ul","Pokud hledáte nejnovější trendy na trhu, máme tu čest vám představit <b>Led baterka Philips Bílý G 400 lm 2 kusů (6500 K)</b>!<br><br><ul><li>Typ: <ul><li>Led baterka</li><li>žárovka</li></ul></li><li>Barva: Bílý</li><li>Vlastnosti: Nastavitelné</li><li>Energetická klasifikace: G</li><li>Napětí: 12 V</li><li>Technologie: LED</li><li>Kompatibilní: <ul><li>iOS, Android</li><li>Amazon Alexa</li><li>Google Home</li></ul></li><li>Životnost: 25000 hodin</li><li>Světelný tok: 400 lm</li><li>Teplota bar",Pop Pulse Emporium,https://cdnbigbuy.com/images/8719514491649_S71017372_P00.jpg,https://cdnbigbuy.com/images/8719514491649_S71017372_P50.jpg,https://cdnbigbuy.com/images/8719514491649_S71017372_P10.jpg,https://cdnbigbuy.com/images/8719514491649_S71017372_P20.jpg,3548.44,4,NEW,9.65,9.6,10.96,0.15,1015.33,CZK,2,5,3
S0389523,0197853285545,cs-CZ,Gardening & DIY,Taška přes rameno Michael Kors 35T4STVC5L-OPTIC-WHITE Bílý 22 x 20 x 7 cm,"Pokud hledáte nejnovější trendy na trhu, máme tu čest vám představit <b>Taška přes rameno Michael Kors 35T4STVC5L-OPTIC-WHITE Bílý 22 x 20 x 7 cm</b>!","Pokud hledáte nejnovější trendy na trhu, máme tu čest vám představit <b>Taška přes rameno Michael Kors 35T4STVC5L-OPTIC-WHITE Bílý 22 x 20 x 7 cm</b>!<br><br><ul><li>Typ: Taška přes rameno</li><li>Barva: Bílý</li><li>Materiál: Plátno</li><li>Typ zapínání: zip</li><li>Obsahuje: Obsahuje pouzdro nebo kryt značky</li><li>Přibližné rozměry: 22 x 20 x 7 cm</li></ul>",Pop Pulse Emporium,https://cdnbigbuy.com/images/0197853285545_S0389523_P00.jpg,https://cdnbigbuy.com/images/0197853285545_S0389523_P10.jpg,https://cdnbigbuy.com/images/0197853285545_S0389523_P20.jpg,,3653.49,10,NEW,10.0,10.0,10.0,0.3,1000.0,CZK,2,5,3
S2237057,4899888787075,cs-CZ,Gardening & DIY,Miska na Oříšky Pompeya Ø 16 cm (3 kusů),"Pokud při zařizování vašeho domova kladete důraz na všelijaké detaily a chcete být průběžně informován o nejnovějších produktech, které vám usnadní ži","Pokud při zařizování vašeho domova kladete důraz na všelijaké detaily a chcete být průběžně informován o nejnovějších produktech, které vám usnadní život, nakupujte <b>Miska na Oříšky Pompeya Ø 16 cm (3 kusů)</b> za tu nejlepší cenu.<br><br><ul><li>Barva: <ul><li>Modrý</li><li>Černý</li></ul></li><li>Typ: Miska</li><li>Kusů: 3 kusů</li><li>Přibližný průměr: Ø 16 cm</li></ul>",Pop Pulse Emporium,https://cdnbigbuy.com/images/s2237057_1746514596-remove-background_icon0.jpg,https://cdnbigbuy.com/images/S2237057_1746514596-remove-background0.jpg,,,3476.11,8,NEW,20.0,20.0,21.0,3.13,8400.0,CZK,2,5,3
S7270453,4894816091491,cs-CZ,Gardening & DIY,Pánské hodinky Police PEWJG0005004 Stříbřitý,"Pokud sledujete trendy v oblasti módy a doplňků, nakupujte <b>Pánské hodinky Police PEWJG0005004 Stříbřitý</b> za nejlepší ceny.<br><br><ul><li>Pohlav","Pokud sledujete trendy v oblasti módy a doplňků, nakupujte <b>Pánské hodinky Police PEWJG0005004 Stříbřitý</b> za nejlepší ceny.<br><br><ul><li>Pohlaví: Pánský</li><li>Další odkazy: Č.</li><li>Typ hodinek: Náramkové hodinky</li><li>Materiál pláště: Nerezová ocel</li><li>Barva: Stříbřitý</li><li>Barva ciferníku: Modrý</li><li>Funguje na baterie: 1 Litio Ion, incluidas</li><li>Typ zapínání: Sklápěcí uzávěr</li></ul>",Pop Pulse Emporium,https://cdnbigbuy.com/images/4894816091491_R01.jpg,https://cdnbigbuy.com/images/4894816091491_R11.jpg,https://cdnbigbuy.com/images/4894816091491_R21.jpg,https://cdnbigbuy.com/images/4894816091491_R31.jpg,3637.13,2,NEW,32.0,19.0,10.0,0.4,6080.0,CZK,2,5,3
S71010232,5410527703172,cs-CZ,Gardening & DIY,Solární lampa Garden ID Column,"Pokud při zařizování vašeho domova kladete důraz na všelijaké detaily a chcete být průběžně informován o nejnovějších produktech, které vám usnadní ži","Pokud při zařizování vašeho domova kladete důraz na všelijaké detaily a chcete být průběžně informován o nejnovějších produktech, které vám usnadní život, nakupujte <b>Solární lampa Garden ID Column</b> za tu nejlepší cenu.<br><br><ul><li>Typ: Solární lampa</li><li>Přibližný průměr: Ø 20 cm</li><li>Přibližná výdrž: 6-8 hodin</li></ul>",Pop Pulse Emporium,https://cdnbigbuy.com/images/5410527703172_S71010232_P00.jpg,https://cdnbigbuy.com/images/5410527703172_S71010232_P10.jpg,,,3623.42,1,NEW,84.0,23.0,22.0,1.74,42504.0,CZK,2,5,3
S0346950,0091661477928,cs-CZ,Gardening & DIY,Dámské hodinky GC Y31003L1 (Ø 32 mm),"Pokud sledujete trendy v oblasti módy a doplňků, nakupujte <b>Dámské hodinky GC Y31003L1 (Ø 32 mm)</b> za nejlepší ceny.<br><br><ul><li>Barva: Stříbři","Pokud sledujete trendy v oblasti módy a doplňků, nakupujte <b>Dámské hodinky GC Y31003L1 (Ø 32 mm)</b> za nejlepší ceny.<br><br><ul><li>Barva: Stříbřitý</li><li>Pohlaví: Dáma</li><li>Další odkazy: Č.</li><li>Typ hodinek: Náramkové hodinky</li><li>Materiál pásku: Ocel</li><li>Materiál pouzdra hodinek: Nerezová ocel</li><li>Typ pohybu: Křemen</li><li>Sklo: Minerál</li><li>Vodotěsnost: 5 atm</li><li>Obsahuje: K produktu dostanete originální krabičku</li><li>Typ zapínání: Tlakové</li><li>Barva cifer",Pop Pulse Emporium,https://cdnbigbuy.com/images/0091661477928_A02.jpg,https://cdnbigbuy.com/images/43309_mandatory-watch2.jpg,,,3867.03,5,NEW,32.0,19.0,10.0,0.4,6080.0,CZK,2,5,3
S7250714,3608701047514,cs-CZ,Gardening & DIY,Dámské hodinky Nixon A327-3233,"Pokud sledujete trendy v oblasti módy a doplňků, nakupujte <b>Dámské hodinky Nixon A327-3233</b> za nejlepší ceny.<br><br><ul><li>Pohlaví: Dáma</li><l","Pokud sledujete trendy v oblasti módy a doplňků, nakupujte <b>Dámské hodinky Nixon A327-3233</b> za nejlepší ceny.<br><br><ul><li>Pohlaví: Dáma</li><li>Další odkazy: Č.</li><li>Typ hodinek: Náramkové hodinky</li></ul>",Pop Pulse Emporium,https://cdnbigbuy.com/images/3608701047514_S7250714_P02.jpg,https://cdnbigbuy.com/images/49878_mandatory-watch2.jpg,,,4129.67,2,NEW,39.0,19.0,10.0,0.4,7410.0,CZK,2,5,3
S0387160,0194900033579,cs-CZ,Gardening & DIY,Dámská Taška Michael Kors 35F0GTVT9L-OPTIC-WHITE Bílý 45 x 29 x 16 cm,Chcete držet krok s módou a máte rádi drobné doplňky? Přinášíme vám <b>Dámská Taška Michael Kors 35F0GTVT9L-OPTIC-WHITE Bílý 45 x 29 x 16 cm</b> a šir,Chcete držet krok s módou a máte rádi drobné doplňky? Přinášíme vám <b>Dámská Taška Michael Kors 35F0GTVT9L-OPTIC-WHITE Bílý 45 x 29 x 16 cm</b> a široký výběr trendy kabelek a peněženek!<br><br><ul><li>Pohlaví: Dáma</li><li>Typ: Dámská Taška</li><li>Barva: Bílý</li><li>Složení: Kůže</li><li>Typ zapínání: zip</li><li>Obsahuje: Obsahuje pouzdro nebo kryt značky</li><li>Přibližné rozměry: 45 x 29 x 16 cm</li></ul>,Pop Pulse Emporium,https://cdnbigbuy.com/images/S0387160_1730366127-remove-background0.jpg,https://cdnbigbuy.com/images/0194900033579_S0387160_P00.jpg,https://cdnbigbuy.com/images/0194900033579_S0387160_P10.jpg,,3824.4,10,NEW,10.0,10.0,10.0,0.3,1000.0,CZK,2,5,3
S0353708,0883663748591,cs-CZ,Gardening & DIY,Pánské sluneční brýle Chopard SCH156M57703P Černý ø 57 mm,"Pokud rádi nosíte trendy <b>módní doplňky</b> a váš styl se bez nich neobejde, nenechte si ujít <b>Pánské sluneční brýle Chopard SCH156M57703P Černý ø","Pokud rádi nosíte trendy <b>módní doplňky</b> a váš styl se bez nich neobejde, nenechte si ujít <b>Pánské sluneční brýle Chopard SCH156M57703P Černý ø 57 mm</b>! Vyberte si ty nejlepší značkové <b>sluneční brýle</b>.<br><br><ul><li>Obsahuje: K produktu dostanete originální krabičku</li><li>Typ: Pánské sluneční brýle</li><li>ochrana: 100% ochrana proti UV záření (UV400)</li><li>Pohlaví: Pánský</li><li>Materiál: <ul><li>Polykarbonát</li><li>Acetát</li></ul></li><li>Materiál čočky: Polykarbonát</li",Pop Pulse Emporium,https://cdnbigbuy.com/images/0883663748591_S0353708_P0-v_12.jpg,,,,3608.2,10,NEW,10.0,10.0,10.0,0.3,1000.0,CZK,2,5,3
S0388884,0196237633620,cs-CZ,Gardening & DIY,Taška přes rameno Michael Kors Leida Růžový 33 X 30 X 12 CM,"Pokud hledáte nejnovější trendy na trhu, máme tu čest vám představit <b>Taška přes rameno Michael Kors Leida Růžový 33 X 30 X 12 CM</b>!<br><br><ul><l","Pokud hledáte nejnovější trendy na trhu, máme tu čest vám představit <b>Taška přes rameno Michael Kors Leida Růžový 33 X 30 X 12 CM</b>!<br><br><ul><li>Typ: Taška</li><li>Pohlaví: Dáma</li><li>Barva: Růžový</li><li>Materiál: Plátno</li><li>Typ zapínání: zip</li><li>Obsahuje: Obsahuje pouzdro nebo kryt značky</li><li>Přibližné rozměry: 33 X 30 X 12 CM</li></ul>",Pop Pulse Emporium,https://cdnbigbuy.com/images/0196237633620_S0388884_P00.jpg,https://cdnbigbuy.com/images/0196237633620_S0388884_P10.jpg,https://cdnbigbuy.com/images/0196237633620_S0388884_P20.jpg,,4038.32,22,NEW,12.0,33.0,22.0,0.4,8712.0,CZK,2,5,3
S37115154,8027280005732,cs-CZ,Gardening & DIY,Základna sedadla OMP HC/738 Ocel,Vybavte svůj vůz posledními produkty průmyslu! Kupte <b>Základna sedadla OMP HC/738 Ocel</b> a už o nic nepřijdete!<br><br><ul><li>Doporučené použití:,Vybavte svůj vůz posledními produkty průmyslu! Kupte <b>Základna sedadla OMP HC/738 Ocel</b> a už o nic nepřijdete!<br><br><ul><li>Doporučené použití: Automobil</li><li>Obsahuje: Fixační sada</li><li>Typ: Základna sedadla</li><li>Pozice: Vlevo - vpravo</li><li>Barva: Černý</li><li>Materiál: Ocel</li><li>Kompatibilní vozidlo: Volkswagen Golf 2Nd Series</li></ul>,Pop Pulse Emporium,https://cdnbigbuy.com/images/8027280005732_S37115154_P00.jpg,,,,3812.6,1,NEW,45.0,45.0,20.0,10.0,40500.0,CZK,2,5,3
S0388893,0197853284890,cs-CZ,Gardening & DIY,Taška přes rameno Michael Kors Leida Růžový 34 x 29 x 12 cm,"Pokud hledáte nejnovější trendy na trhu, máme tu čest vám představit <b>Taška přes rameno Michael Kors Leida Růžový 34 x 29 x 12 cm</b>!<br><br><ul><l","Pokud hledáte nejnovější trendy na trhu, máme tu čest vám představit <b>Taška přes rameno Michael Kors Leida Růžový 34 x 29 x 12 cm</b>!<br><br><ul><li>Typ: Taška</li><li>Pohlaví: Dáma</li><li>Barva: Růžový</li><li>Materiál: Plátno</li><li>Typ zapínání: zip</li><li>Obsahuje: Obsahuje pouzdro nebo kryt značky</li><li>Přibližné rozměry: 34 x 29 x 12 cm</li></ul>",Pop Pulse Emporium,https://cdnbigbuy.com/images/0197853284890_S0388893_P00.jpg,https://cdnbigbuy.com/images/0197853284890_S0388893_P20.jpg,https://cdnbigbuy.com/images/0197853284890_S0388893_P10.jpg,,4594.05,16,NEW,12.0,33.0,22.0,0.4,8712.0,CZK,2,5,3
S0387161,0194900033678,cs-CZ,Gardening & DIY,Dámská Taška Michael Kors 35F0GTVT9L-POWDER-BLUSH-ROSE-POUDRE Růžový 46 x 29 x 16 cm,Chcete držet krok s módou a máte rádi drobné doplňky? Přinášíme vám <b>Dámská Taška Michael Kors 35F0GTVT9L-POWDER-BLUSH-ROSE-POUDRE Růžový 46 x 29 x ,Chcete držet krok s módou a máte rádi drobné doplňky? Přinášíme vám <b>Dámská Taška Michael Kors 35F0GTVT9L-POWDER-BLUSH-ROSE-POUDRE Růžový 46 x 29 x 16 cm</b> a široký výběr trendy kabelek a peněženek!<br><br><ul><li>Pohlaví: Dáma</li><li>Typ: Dámská Taška</li><li>Barva: Růžový</li><li>Složení: Kůže</li><li>Typ zapínání: zip</li><li>Obsahuje: Obsahuje pouzdro nebo kryt značky</li><li>Přibližné rozměry: 46 x 29 x 16 cm</li></ul>,Pop Pulse Emporium,https://cdnbigbuy.com/images/S0387161_1730366140-remove-background0.jpg,https://cdnbigbuy.com/images/0194900033678_S0387161_P10.jpg,https://cdnbigbuy.com/images/0194900033678_S0387161_P00.jpg,,3824.4,10,NEW,10.0,10.0,10.0,0.3,1000.0,CZK,2,5,3
S7109290,3165140669603,cs-CZ,Gardening & DIY,Vrtací kladivo BOSCH PBH 2500 SRE 600 W 2000 rpm,"Pokud při zařizování vašeho domova kladete důraz na všelijaké detaily a chcete být průběžně informován o nejnovějších produktech, které vám usnadní ži","Pokud při zařizování vašeho domova kladete důraz na všelijaké detaily a chcete být průběžně informován o nejnovějších produktech, které vám usnadní život, nakupujte <b>Vrtací kladivo BOSCH PBH 2500 SRE 600 W 2000 rpm</b> za tu nejlepší cenu.<br><br><ul><li>Typ zástrčky: Zástrčka EU</li><li>Zásuvný produkt: Ano</li><li>Obsahuje: Nosič vrtáků</li><li>Vlastnosti: <ul><li>Dvojitá rukojeť</li><li>Lehký</li></ul></li><li>Barva: Zelená</li><li>Příkon: 600 W</li><li>Napětí: 230 V</li><li>Rychlost: 2000 ",Pop Pulse Emporium,https://cdnbigbuy.com/images/3165140669603_S7109290_P01.jpg,https://cdnbigbuy.com/images/3165140669603_R101.jpg,https://cdnbigbuy.com/images/3165140669603_R41.jpg,https://cdnbigbuy.com/images/3165140669603_R111.jpg,4683.89,10,NEW,36.6,38.4,11.0,4.64,15459.84,CZK,2,5,3
S7926304,4751029894564,cs-CZ,Gardening & DIY,Světelná girlanda Thorgeon Černý 2000 W 20 m 40,"<p>Chcete-li dodat svému domovu kouzlo originality, pomůže vám s tím <b>Světelná girlanda Thorgeon Černý 2000 W 20 m 40</b>.</p><br><br><ul><li>Není z","<p>Chcete-li dodat svému domovu kouzlo originality, pomůže vám s tím <b>Světelná girlanda Thorgeon Černý 2000 W 20 m 40</b>.</p><br><br><ul><li>Není zahrnut: žárovky</li><li>Typ: <ul><li>Objímky</li><li>LED řetězová světla</li><li>Světelná girlanda</li></ul></li><li>Barva: Černý</li><li>žárovky: 40</li><li>Příkon: 2000 W</li><li>Patice: E27</li><li>Napětí: 220-240 V</li><li>Délka kabelu: 20 m</li><li>Frekvence: 50/60 Hz</li><li>Stupeň krytí: IP44</li><li>Doporučené použití: Vnitřek/Exteriér</li>",Pop Pulse Emporium,https://cdnbigbuy.com/images/4751029894564_S7926304_P00.jpg,,,,3716.3,16,NEW,20.0,30.0,20.0,2.0,12000.0,CZK,2,5,3
S7285781,8052011752753,cs-CZ,Gardening & DIY,Dámské hodinky LIU JO TLJ2057,"Pokud sledujete trendy v oblasti módy a doplňků, nakupujte <b>Dámské hodinky LIU JO TLJ2057</b> za nejlepší ceny.<br><br><ul><li>Pohlaví: Dáma</li><li","Pokud sledujete trendy v oblasti módy a doplňků, nakupujte <b>Dámské hodinky LIU JO TLJ2057</b> za nejlepší ceny.<br><br><ul><li>Pohlaví: Dáma</li><li>Další odkazy: Č.</li><li>Typ hodinek: Náramkové hodinky</li><li>Barva: <ul><li>Černý</li><li>Stříbřitý</li></ul></li><li>Přibližný průměr: 36 mm</li></ul>",Pop Pulse Emporium,https://cdnbigbuy.com/images/8052011752753_S7285781_P01.jpg,https://cdnbigbuy.com/images/84838_mandatory-watch1.jpg,,,4366.81,1,NEW,39.0,19.0,10.0,0.4,7410.0,CZK,2,5,3
S7167776,8718696170793,cs-CZ,Gardening & DIY,LED lampa Philips (6500 K),"Pokud při zařizování vašeho domova kladete důraz na všelijaké detaily a chcete být průběžně informován o nejnovějších produktech, které vám usnadní ži","Pokud při zařizování vašeho domova kladete důraz na všelijaké detaily a chcete být průběžně informován o nejnovějších produktech, které vám usnadní život, nakupujte <b>LED lampa Philips (6500 K)</b> za tu nejlepší cenu.<br><br><ul><li>Zásuvný produkt: Ano</li><li>Typ zástrčky: Zástrčka EU</li><li>Stupeň krytí: IP20</li><li>Teplota barev: 6500 K</li><li>Barva: Bílý</li><li>Typ: LED Světlý</li><li>Materiál: <ul><li>Syntetický</li><li>Kov</li><li>Plastické</li></ul></li><li>Vlastnosti: <ul><li>LED ",Pop Pulse Emporium,https://cdnbigbuy.com/images/8718696170793_S7167776_P04.jpg,https://cdnbigbuy.com/images/8718696170793_S7167776_P14.jpg,https://cdnbigbuy.com/images/8718696170793_I04.jpg,https://cdnbigbuy.com/images/8718696170793_I24.jpg,4716.24,16,NEW,20.8,30.1,9.9,1.09,6198.19,CZK,2,5,3
S7726011,5711045326929,cs-CZ,Gardening & DIY,Štítky do Tiskárny Zebra 880199-025D Bílý Černý (12 kusů),"Pokud se zajímáte o <b>počítače a elektronika</b>, rádi máte doma moderní vybavení a hlídáte si každý detail, kupte si <b>Štítky do Tiskárny Zebra 880","Pokud se zajímáte o <b>počítače a elektronika</b>, rádi máte doma moderní vybavení a hlídáte si každý detail, kupte si <b>Štítky do Tiskárny Zebra 880199-025D Bílý Černý (12 kusů)</b> za nejlepší ceny.<br><br><ul><li>Typ: Lepidlo</li><li>Barva: <ul><li>Bílý</li><li>Černý</li></ul></li><li>Technologie: Tepelná</li><li>Kusů: <ul><li>30960 Etikety</li><li>12 kusů</li></ul></li><li>Tvar: Obdélníkový</li><li>Připojení: Ethernet LAN</li></ul>",Pop Pulse Emporium,https://cdnbigbuy.com/images/5711045326929_S7726011_P10.jpg,https://cdnbigbuy.com/images/5711045326929_S7726011_P00.jpg,,,4387.75,4,NEW,26.0,25.5,21.5,6.72,14254.5,CZK,2,5,3
