id_offer,ean,locale,category,title,short_description,description,manufacturer,picture_1,picture_2,picture_3,picture_4,price_cs,quantity,condition,length,width,height,weight,content_volume,currency,handling_time,delivery_time_max,delivery_time_min
S55008564,0843173124711,cs-CZ,Gardening & DIY,Webkamera Elo Touch Systems E201494,"Pokud se zajímáte o <b>počítače a elektronika</b>, rádi máte doma moderní vybavení a hlídáte si každý detail, kupte si <b>Webkamera Elo Touch Systems ","Pokud se zajímáte o <b>počítače a elektronika</b>, rádi máte doma moderní vybavení a hlídáte si každý detail, kupte si <b>Webkamera Elo Touch Systems E201494</b> za nejlepší ceny.<br><br><ul><li>Typ: Webkamera</li><li>Barva: Černý</li><li>Vlastnosti: <ul><li>Integrovaný mikrofon</li><li>Automatické zaostření</li></ul></li><li>Fotoaparát: 8 MP</li><li>Rozhraní: USB</li></ul>",Pop Pulse Emporium,https://cdnbigbuy.com/images/885240920.jpg,https://cdnbigbuy.com/images/885240940.jpg,https://cdnbigbuy.com/images/885240950.jpg,https://cdnbigbuy.com/images/885240960.jpg,4405.26,10,NEW,18.0,12.0,7.0,0.18,1512.0,CZK,2,5,3
S7271048,8430622817038,cs-CZ,Gardening & DIY,Pánské hodinky Festina F20669/2,"Pokud sledujete trendy v oblasti módy a doplňků, nakupujte <b>Pánské hodinky Festina F20669/2</b> za nejlepší ceny.<br><br><ul><li>Pohlaví: Pánský</li","Pokud sledujete trendy v oblasti módy a doplňků, nakupujte <b>Pánské hodinky Festina F20669/2</b> za nejlepší ceny.<br><br><ul><li>Pohlaví: Pánský</li><li>Další odkazy: Č.</li><li>Typ hodinek: Náramkové hodinky</li></ul>",Pop Pulse Emporium,https://cdnbigbuy.com/images/8430622817038_S7271048_P00.jpg,https://cdnbigbuy.com/images/70212_mandatory-watch0.jpg,,,3929.08,50,NEW,32.0,19.0,10.0,0.4,6080.0,CZK,2,5,3
S7920436,8425998083729,cs-CZ,Gardening & DIY,Šroubovací vrtačka Koma Tools Pro Series,"Pokud při zařizování vašeho domova kladete důraz na všelijaké detaily a chcete být průběžně informován o nejnovějších produktech, které vám usnadní ži","Pokud při zařizování vašeho domova kladete důraz na všelijaké detaily a chcete být průběžně informován o nejnovějších produktech, které vám usnadní život, nakupujte <b>Šroubovací vrtačka Koma Tools Pro Series</b> za tu nejlepší cenu.<br><br><ul><li>Barva: <ul><li>Modrý</li><li>Černý</li></ul></li><li>Obsahuje: <ul><li>Nabíječka na baterie</li><li>Baterie x 2</li><li>Aktovka</li><li>Háček na pásek</li><li>Nosič vrtáků</li></ul></li><li>Vlastnosti: <ul><li>Klip na pás</li><li>Regulovatelný výkon</",Pop Pulse Emporium,https://cdnbigbuy.com/images/S7920436_21094_1686313715_cropped2.jpg,https://cdnbigbuy.com/images/8425998083729_S7920436_P62.jpg,https://cdnbigbuy.com/images/8425998083729_S7920436_P02.jpg,https://cdnbigbuy.com/images/8425998083729_S7920436_P12.jpg,4196.67,50,NEW,25.0,25.0,15.0,3.0,9375.0,CZK,2,5,3
S7175765,3165140973366,cs-CZ,Gardening & DIY,elektrický zastřihovač BOSCH Easy GrassCut 18V-230 18 V Ø 23 cm,"Pokud při zařizování vašeho domova kladete důraz na všelijaké detaily a chcete být průběžně informován o nejnovějších produktech, které vám usnadní ži","Pokud při zařizování vašeho domova kladete důraz na všelijaké detaily a chcete být průběžně informován o nejnovějších produktech, které vám usnadní život, nakupujte <b>elektrický zastřihovač BOSCH Easy GrassCut 18V-230 18 V Ø 23 cm</b> za tu nejlepší cenu.<br><br><ul><li>Nápajecí Zdroj: Baterie</li><li>Typ baterie: Litio Ion</li><li>Obsahuje: <ul><li>Dobíjecí lithiová baterie</li><li>Nabíječka na baterie</li></ul></li><li>Zásuvný produkt: Ano</li><li>Typ zástrčky: Zástrčka EU</li><li>Napětí: 18 ",Pop Pulse Emporium,https://cdnbigbuy.com/images/3165140973366_S7175765_P01.jpg,https://cdnbigbuy.com/images/3165140973366_S7175765_P21.jpg,https://cdnbigbuy.com/images/3165140973366_S7175765_P41.jpg,https://cdnbigbuy.com/images/3165140973366_S7175765_P11.jpg,4213.41,25,NEW,47.0,22.0,14.0,3.3,14476.0,CZK,2,5,3
S7267464,0716736777818,cs-CZ,Gardening & DIY,Pánské sluneční brýle Carrera 1057_S,"Pokud rádi nosíte trendy <b>módní doplňky</b> a váš styl se bez nich neobejde, nenechte si ujít <b>Pánské sluneční brýle Carrera 1057_S</b>! Vyberte s","Pokud rádi nosíte trendy <b>módní doplňky</b> a váš styl se bez nich neobejde, nenechte si ujít <b>Pánské sluneční brýle Carrera 1057_S</b>! Vyberte si ty nejlepší značkové <b>sluneční brýle</b>.<br><br><ul><li>Typ: Pánské sluneční brýle</li><li>ochrana: 100% ochrana proti UV záření (UV400)</li><li>Pohlaví: Pánský</li></ul>",Pop Pulse Emporium,https://cdnbigbuy.com/images/0716736777818_R00.jpg,https://cdnbigbuy.com/images/0716736777818_R30.jpg,https://cdnbigbuy.com/images/0716736777818_R40.jpg,https://cdnbigbuy.com/images/0716736777818_R10.jpg,4719.67,2,NEW,10.22,9.75,10.06,0.28,1002.43,CZK,2,5,3
S0391216,0194900082171,cs-CZ,Gardening & DIY,Příruční taška Michael Kors Jet Set Travel,"Pokud hledáte nejnovější trendy na trhu, máme tu čest vám představit <b>Příruční taška Michael Kors Jet Set Travel</b>!<br><br><ul><li>Typ: Taška</li>","Pokud hledáte nejnovější trendy na trhu, máme tu čest vám představit <b>Příruční taška Michael Kors Jet Set Travel</b>!<br><br><ul><li>Typ: Taška</li><li>Pohlaví: Dáma</li><li>Barva: Modrý</li><li>Materiál: Plátno</li><li>Typ zapínání: zip</li><li>Obsahuje: Obsahuje pouzdro nebo kryt značky</li><li>Přibližné rozměry: 42 x 30 x 15 cm</li></ul>",Pop Pulse Emporium,https://cdnbigbuy.com/images/S0391216_1749553045-remove-background0.jpg,https://cdnbigbuy.com/images/0194900082171_S0391216_P00.jpg,https://cdnbigbuy.com/images/0194900082171_S0391216_P10.jpg,https://cdnbigbuy.com/images/0194900082171_S0391216_P20.jpg,3824.4,10,NEW,10.0,10.0,10.0,0.3,1000.0,CZK,2,5,3
S7710269,0632983022054,cs-CZ,Gardening & DIY,Toner Kyocera 1T02LKBNL0 Černý Purpurová,Vracejte se do kanceláře bez zapomenutí jediné věci! Nakupujte <b>Toner Kyocera 1T02LKBNL0 Černý Purpurová</b> a nechte kolegy závidět!<br><br><ul><li,Vracejte se do kanceláře bez zapomenutí jediné věci! Nakupujte <b>Toner Kyocera 1T02LKBNL0 Černý Purpurová</b> a nechte kolegy závidět!<br><br><ul><li>Barva: <ul><li>Purpurová</li><li>Černý</li></ul></li><li>Technologie: Laser</li><li>Typ: Toner</li><li>velikost: A4</li><li>Vlastnosti: <ul><li>podle barvy</li><li>Originální</li></ul></li><li>Přesnost (relativní vlhkost): 20 % - 80 %</li><li>Funkční rozpětí teploty: 5º / 35º</li></ul>,Pop Pulse Emporium,https://cdnbigbuy.com/images/0632983022054_I01.jpg,,,,3529.4,1,NEW,60.0,13.5,11.5,1.15,9315.0,CZK,2,5,3
S71013884,0197641223889,cs-CZ,Gardening & DIY,Sportovní batoh The North Face Base Camp Duffel Černý 71 L,Vracejte se do kanceláře bez zapomenutí jediné věci! Nakupujte <b>Sportovní batoh The North Face Base Camp Duffel Černý 71 L</b> a nechte kolegy závid,"Vracejte se do kanceláře bez zapomenutí jediné věci! Nakupujte <b>Sportovní batoh The North Face Base Camp Duffel Černý 71 L</b> a nechte kolegy závidět!<br><br><p><b>Base Camp Duffel</b> od <b>The North Face</b> je sportovní batoh navržený pro ty, kteří potřebují odolný a prostorný zavazadlový prostor pro venkovní aktivity nebo sport. S objemem <b>71 litrů</b> nabízí dostatek místa pro přepravu oděvů i objemného vybavení, ideální pro delší cesty nebo sporty vyžadující hodně materiálu. Jeho unis",Pop Pulse Emporium,https://cdnbigbuy.com/images/0197641223889_S71013884_P00.jpg,https://cdnbigbuy.com/images/0197641223889_S71013884_P10.jpg,https://cdnbigbuy.com/images/0197641223889_S71013884_P20.jpg,https://cdnbigbuy.com/images/0197641223889_S71013884_P30.jpg,3966.76,23,NEW,20.63,35.0,34.78,0.95,25112.9,CZK,2,5,3
M0518771,4519232193603,cs-CZ,Gardening & DIY,Originální toner Toshiba e-STUDIO2510AC Purpurová,Vracejte se do kanceláře bez zapomenutí jediné věci! Nakupujte <b>Originální toner Toshiba e-STUDIO2510AC Purpurová</b> a nechte kolegy závidět!<br><b,Vracejte se do kanceláře bez zapomenutí jediné věci! Nakupujte <b>Originální toner Toshiba e-STUDIO2510AC Purpurová</b> a nechte kolegy závidět!<br><br><ul><li>Typ: Toner</li><li>Barva: Purpurová</li></ul>,Pop Pulse Emporium,https://cdnbigbuy.com/images/M0518771_1730721760-remove-background0.jpg,,,,4637.45,1,NEW,52.0,10.0,9.0,1.02,4680.0,CZK,2,5,3
S37114644,8027281123299,cs-CZ,Gardening & DIY,Kartingová kombinéza OMP KS-4 Černý S,Vybavte svůj vůz posledními produkty průmyslu! Kupte <b>Kartingová kombinéza OMP KS-4 Černý S</b> a už o nic nepřijdete!<br><br><ul><li>Barva: Černý</,Vybavte svůj vůz posledními produkty průmyslu! Kupte <b>Kartingová kombinéza OMP KS-4 Černý S</b> a už o nic nepřijdete!<br><br><ul><li>Barva: Černý</li><li>Materiál: <ul><li>Polyester</li><li>Bavlna</li></ul></li><li>Vlastnosti: <ul><li>Odolný</li><li>Prodyšný</li><li>Elastické</li></ul></li><li>Osvědčení: cik fia nº1</li><li>Velikost: S</li></ul>,Pop Pulse Emporium,https://cdnbigbuy.com/images/8027281123299_S37114644_P00.jpg,https://cdnbigbuy.com/images/8027281123299_S37114644_P10.jpg,,,4083.62,2,NEW,35.0,30.0,10.0,4.0,10500.0,CZK,2,5,3
S71004564,4059952678986,cs-CZ,Gardening & DIY,Domácí nářadí klíče BOSCH,"Pokud při zařizování vašeho domova kladete důraz na všelijaké detaily a chcete být průběžně informován o nejnovějších produktech, které vám usnadní ži","Pokud při zařizování vašeho domova kladete důraz na všelijaké detaily a chcete být průběžně informován o nejnovějších produktech, které vám usnadní život, nakupujte <b>Domácí nářadí klíče BOSCH</b> za tu nejlepší cenu.<br><br><ul><li>Barva: Modrý</li></ul>",Pop Pulse Emporium,https://cdnbigbuy.com/images/4059952678986_S71004564_P00.jpg,https://cdnbigbuy.com/images/4059952678986_S71004564_P40.jpg,https://cdnbigbuy.com/images/4059952678986_S71004564_P10.jpg,https://cdnbigbuy.com/images/4059952678986_S71004564_P20.jpg,4627.55,2,NEW,35.56,43.94,10.41,3.58,16265.69,CZK,2,5,3
S55080500,0097855140876,cs-CZ,Gardening & DIY,Držák Logitech 939-001656,"Pokud se zajímáte o <b>počítače a elektronika</b>, rádi máte doma moderní vybavení a hlídáte si každý detail, kupte si <b>Držák Logitech 939-001656</b","Pokud se zajímáte o <b>počítače a elektronika</b>, rádi máte doma moderní vybavení a hlídáte si každý detail, kupte si <b>Držák Logitech 939-001656</b> za nejlepší ceny.<br><br><ul><li>Typ: <ul><li>Kamera/web kamera</li><li>Držák</li><li>pevný</li></ul></li><li>Kompatibilní: Logitech MeetUp</li><li>Barva: Černý</li><li>Montáž: Montáž na stěnu</li><li>Rok: 2018</li><li>Napětí: 230 V</li><li>Připojení: SATA</li><li>Typ instalace: Montáž na stěnu</li><li>Délka: 70 cm</li><li>Nápajecí Zdroj: AC</li>",Pop Pulse Emporium,https://cdnbigbuy.com/images/0097855140876_S5580500_P02.jpg,,,,4386.61,5,NEW,4.06,21.08,8.99,0.71,770.24,CZK,2,5,3
S91119530,4894947051791,cs-CZ,Gardening & DIY,"Chytré telefony Tecno 6,67"" MediaTek Helio G81 8 GB RAM 256 GB Bílý","Pokud se zajímáte o <b>počítače a elektronika</b>, rádi máte doma moderní vybavení a hlídáte si každý detail, kupte si <b>Chytré telefony Tecno 6,67"" ","Pokud se zajímáte o <b>počítače a elektronika</b>, rádi máte doma moderní vybavení a hlídáte si každý detail, kupte si <b>Chytré telefony Tecno 6,67"" MediaTek Helio G81 8 GB RAM 256 GB Bílý</b> za nejlepší ceny.<br><br><ul><li>Úhlopříčka obrazovky (cm): 16,9 cm</li><li>Zásuvný produkt: Ano</li><li>Typ: <ul><li>Chytré telefony</li><li>Dual SIM</li></ul></li><li>Typ zástrčky: Zástrčka EU</li><li>Rozlišení (px): 720 x 1600 px</li><li>Vlastnosti: <ul><li>Digitální čtečka otisků prstů</li><li>GPS</li",Pop Pulse Emporium,https://cdnbigbuy.com/images/4894947051791_S91119530_P00.jpg,https://cdnbigbuy.com/images/4894947051791_S91119530_P60.jpg,https://cdnbigbuy.com/images/4894947051791_S91119530_P70.jpg,https://cdnbigbuy.com/images/4894947051791_S91119530_P10.jpg,3457.08,5,NEW,5.0,9.5,19.7,0.42,935.75,CZK,2,5,3
S0390372,0196237506245,cs-CZ,Gardening & DIY,Dámská Taška Michael Kors Cara Modrý,"Pokud hledáte nejnovější trendy na trhu, máme tu čest vám představit <b>Dámská Taška Michael Kors Cara Modrý</b>!<br><br><ul><li>Typ: <ul><li>Taška</l","Pokud hledáte nejnovější trendy na trhu, máme tu čest vám představit <b>Dámská Taška Michael Kors Cara Modrý</b>!<br><br><ul><li>Typ: <ul><li>Taška</li><li>Dámská Taška</li></ul></li><li>Pohlaví: Dáma</li><li>Barva: Modrý</li><li>Materiál: Plátno</li><li>Typ zapínání: zip</li><li>Obsahuje: Obsahuje pouzdro nebo kryt značky</li></ul>",Pop Pulse Emporium,https://cdnbigbuy.com/images/0196237506245_S0390372_P00.jpg,https://cdnbigbuy.com/images/0196237506245_S0390372_P10.jpg,https://cdnbigbuy.com/images/0196237506245_S0390372_P20.jpg,,3653.49,2,NEW,10.0,10.0,10.0,0.3,1000.0,CZK,2,5,3
S7204413,8013260649232,cs-CZ,Gardening & DIY,Pánské hodinky Lorenz 026981BB-N,"Pokud sledujete trendy v oblasti módy a doplňků, nakupujte <b>Pánské hodinky Lorenz 026981BB-N</b> za nejlepší ceny.<br><br><ul><li>Pohlaví: Pánský</l","Pokud sledujete trendy v oblasti módy a doplňků, nakupujte <b>Pánské hodinky Lorenz 026981BB-N</b> za nejlepší ceny.<br><br><ul><li>Pohlaví: Pánský</li><li>Další odkazy: Č.</li><li>Typ hodinek: Náramkové hodinky</li></ul>",Pop Pulse Emporium,https://cdnbigbuy.com/images/8013260649232_S7204413_P00.jpg,https://cdnbigbuy.com/images/4414_mandatory-watch0.jpg,,,4398.79,1,NEW,32.0,19.0,10.0,0.4,6080.0,CZK,2,5,3
S72118269,8099152723167,cs-CZ,Gardening & DIY,Dámské hodinky Tommy Hilfiger 1782588 Zlatá (Ø 36 mm),"Pokud hledáte nejnovější trendy na trhu, máme tu čest vám představit <b>Dámské hodinky Tommy Hilfiger 1782588 Zlatá (Ø 36 mm)</b>!<br><br><ul><li>Dalš","Pokud hledáte nejnovější trendy na trhu, máme tu čest vám představit <b>Dámské hodinky Tommy Hilfiger 1782588 Zlatá (Ø 36 mm)</b>!<br><br><ul><li>Další odkazy: Č.</li><li>Typ hodinek: Náramkové hodinky</li><li>Barva řemínku: Zlatá</li><li>Typ: <ul><li>Chytré hodinky</li><li>Náušnice</li></ul></li><li>Materiál: Mincovní stříbro 925</li><li>Funkce: Datum</li><li>Pohlaví: Dáma</li><li>Obsahuje: Obsahuje pouzdro nebo kryt značky</li><li>Vodotěsnost: 3 atm</li><li>Sklo: Minerál</li><li>Typ pohybu: Kř",Pop Pulse Emporium,https://cdnbigbuy.com/images/8099152723167_S72118269_P00.jpg,https://cdnbigbuy.com/images/117281_mandatory-watch0.jpg,,,3837.34,2,NEW,14.16,11.56,10.0,0.33,1636.9,CZK,2,5,3
S9918685,0197029610089,cs-CZ,Gardening & DIY,Sluchátka Poly 77Y96AA Černý,"Pokud hledáte nejnovější trendy na trhu, máme tu čest vám představit <b>Sluchátka Poly 77Y96AA Černý</b>!<br><br><ul><li>Typ: <ul><li>Sluchátka</li><l","Pokud hledáte nejnovější trendy na trhu, máme tu čest vám představit <b>Sluchátka Poly 77Y96AA Černý</b>!<br><br><ul><li>Typ: <ul><li>Sluchátka</li><li>Sluchátko</li><li>Bezdrátový</li><li>Sluchátka s mikrofonem</li><li>Sluchátka s čelenkou</li></ul></li><li>Šířka: 155 mm</li><li>Hloubka: 67 mm</li><li>Vlastnosti: <ul><li>Rušení hluku</li><li>Integrovaný mikrofon</li><li>Bezdrátová</li><li>Bezdrátový</li><li>Vestavěná baterie</li></ul></li><li>Nápajecí Zdroj: Dobíjecí baterie</li><li>Barva: Čern",Pop Pulse Emporium,https://cdnbigbuy.com/images/0197029610089_S91101120_P00.jpg,https://cdnbigbuy.com/images/0197029610089_R30.jpg,https://cdnbigbuy.com/images/704755990.jpg,https://cdnbigbuy.com/images/0197029610089_R40.jpg,3672.14,1,NEW,21.0,18.5,11.5,1.3,4467.75,CZK,2,5,3
S2441320,8412688527113,cs-CZ,Gardening & DIY,Ledvinka Safta 26 x 29 x 23 cm,"Pokud hledáte nejnovější trendy na trhu, máme tu čest vám představit <b>Ledvinka Safta 26 x 29 x 23 cm</b>!<br><br><ul><li>Pohlaví: <ul><li>Dětské</li","Pokud hledáte nejnovější trendy na trhu, máme tu čest vám představit <b>Ledvinka Safta 26 x 29 x 23 cm</b>!<br><br><ul><li>Pohlaví: <ul><li>Dětské</li><li>Unisex děti</li></ul></li><li>Typ: Ledvinka</li><li>Barva: Vícebarevný</li><li>Důležité informace: <ul><li>Z více designů vybíráme náhodně podle skladové dostupnosti</li><li>Obrázek nemusí zobrazovat všechny dostupné různé modely</li></ul></li><li>Kusů: 1 kusů</li><li>Přibližné rozměry: 26 x 29 x 23 cm</li><li>Země/oblast výroby: Španělsko</li",Pop Pulse Emporium,https://cdnbigbuy.com/images/8412688527113_S2441320_P00.jpg,https://cdnbigbuy.com/images/8412688527113_S2441320_P10.jpg,,,4205.04,20,NEW,23.0,26.0,29.0,1.47,17342.0,CZK,2,5,3
S71011618,3499550388176,cs-CZ,Gardening & DIY,Přenosný reproduktor Thomson WS702 Dřevo 150 W,"Pokud se zajímáte o <b>počítače a elektronika</b>, rádi máte doma moderní vybavení a hlídáte si každý detail, kupte si <b>Přenosný reproduktor Thomson","Pokud se zajímáte o <b>počítače a elektronika</b>, rádi máte doma moderní vybavení a hlídáte si každý detail, kupte si <b>Přenosný reproduktor Thomson WS702 Dřevo 150 W</b> za nejlepší ceny.<br><br><ul><li>Vlastnosti: <ul><li>USB</li><li>S dálkovým ovládáním</li></ul></li><li>Připojení: Bluetooth</li><li>Zvuk: Stereo</li><li>Příkon RMS: 150 W</li><li>Spojnice: <ul><li>2.1</li><li>2.0</li></ul></li><li>Příkon: 150 W</li><li>Typ: Reproduktor s Bluetooth</li><li>Kusů: 1 kusů</li><li>Barva: Dřevo</l",Pop Pulse Emporium,https://cdnbigbuy.com/images/3499550388176_S71011618_P00.jpg,https://cdnbigbuy.com/images/3499550388176_S71011618_P50.jpg,https://cdnbigbuy.com/images/3499550388176_S71011618_P10.jpg,https://cdnbigbuy.com/images/3499550388176_S71011618_P20.jpg,3623.42,25,NEW,53.8,25.3,23.0,4.51,31306.22,CZK,2,5,3
S71001764,8412081289571,cs-CZ,Gardening & DIY,Čistička do bazénů Gre,Tyto nabídky produktů vám zajistí příjemnou letní zábavu. Malí i dospělí si je okamžitě zamilují ! Nakupujte <b>Čistička do bazénů Gre</b> a užívejte ,Tyto nabídky produktů vám zajistí příjemnou letní zábavu. Malí i dospělí si je okamžitě zamilují ! Nakupujte <b>Čistička do bazénů Gre</b> a užívejte si chvíle volna!<br><br><ul><li>Barva: Šedý</li><li>Nápajecí Zdroj: Elektrický kabel</li></ul>,Pop Pulse Emporium,https://cdnbigbuy.com/images/8412081289571R00.jpg,https://cdnbigbuy.com/images/8412081289571_R20.jpg,https://cdnbigbuy.com/images/8412081289571R10.jpg,https://cdnbigbuy.com/images/8412081289571R20.jpg,3977.8,2,NEW,46.0,23.0,25.0,5.96,26450.0,CZK,2,5,3
M0513481,0632983072660,cs-CZ,Gardening & DIY,Toner Kyocera 1T02YJANL0 Žlutý,Vracejte se do kanceláře bez zapomenutí jediné věci! Nakupujte <b>Toner Kyocera 1T02YJANL0 Žlutý</b> a nechte kolegy závidět!<br><br><ul><li>Typ: Tone,Vracejte se do kanceláře bez zapomenutí jediné věci! Nakupujte <b>Toner Kyocera 1T02YJANL0 Žlutý</b> a nechte kolegy závidět!<br><br><ul><li>Typ: Toner</li><li>Barva: Žlutý</li><li>Váha: 500 g</li><li>Vlastnosti: Originální</li><li>Kapacita: 5000 Stránky</li></ul>,Pop Pulse Emporium,https://cdnbigbuy.com/images/0632983072660_M0513481_P00.jpg,,,,3774.92,50,NEW,33.0,11.0,14.0,0.46,5082.0,CZK,2,5,3
S7172018,3700628252450,cs-CZ,Gardening & DIY,Vrtni naslonjač 697094,Tyto nabídky produktů vám zajistí příjemnou letní zábavu. Malí i dospělí si je okamžitě zamilují ! Nakupujte <b>Vrtni naslonjač 697094</b> a užívejte ,Tyto nabídky produktů vám zajistí příjemnou letní zábavu. Malí i dospělí si je okamžitě zamilují ! Nakupujte <b>Vrtni naslonjač 697094</b> a užívejte si chvíle volna!<br><br><ul><li>Barva: Černý</li><li>Vlastnosti: <ul><li>Sklápěcí</li><li>5 Polohy</li></ul></li><li>Typ: Vrtni naslonjač</li><li>Materiál: Hliník</li></ul>,Pop Pulse Emporium,https://cdnbigbuy.com/images/3700628252450_S7172018_P02.jpg,https://cdnbigbuy.com/images/3700628252450_S7172018_P12.jpg,https://cdnbigbuy.com/images/3700628252450_S7172018_P22.jpg,,3796.61,2,NEW,110.0,66.0,7.0,6.22,50820.0,CZK,2,5,3
S0390371,0196237506153,cs-CZ,Gardening & DIY,Batoh Michael Kors 30R4GRKB7C-NAVY Modrý,"Pokud hledáte nejnovější trendy na trhu, máme tu čest vám představit <b>Batoh Michael Kors 30R4GRKB7C-NAVY Modrý</b>!<br><br><ul><li>Pohlaví: Dáma</li","Pokud hledáte nejnovější trendy na trhu, máme tu čest vám představit <b>Batoh Michael Kors 30R4GRKB7C-NAVY Modrý</b>!<br><br><ul><li>Pohlaví: Dáma</li><li>Typ: Batoh</li><li>Barva: Modrý</li><li>Materiál: Plátno</li><li>Obsahuje: Obsahuje pouzdro nebo kryt značky</li></ul>",Pop Pulse Emporium,https://cdnbigbuy.com/images/0196237506153_S0390371_P00.jpg,https://cdnbigbuy.com/images/0196237506153_S0390371_P10.jpg,https://cdnbigbuy.com/images/0196237506153_S0390371_P20.jpg,,3653.49,10,NEW,10.0,10.0,10.0,0.3,1000.0,CZK,2,5,3
S72118274,6740452723167,cs-CZ,Gardening & DIY,Dámské hodinky Tommy Hilfiger 1782663 Zlatá (Ø 40 mm),"Pokud hledáte nejnovější trendy na trhu, máme tu čest vám představit <b>Dámské hodinky Tommy Hilfiger 1782663 Zlatá (Ø 40 mm)</b>!<br><br><ul><li>Dalš","Pokud hledáte nejnovější trendy na trhu, máme tu čest vám představit <b>Dámské hodinky Tommy Hilfiger 1782663 Zlatá (Ø 40 mm)</b>!<br><br><ul><li>Další odkazy: Č.</li><li>Typ hodinek: Náramkové hodinky</li><li>Barva řemínku: Zlatá</li><li>Typ: <ul><li>Chytré hodinky</li><li>Náušnice</li></ul></li><li>Materiál: Mincovní stříbro 925</li><li>Funkce: Datum</li><li>Pohlaví: Dáma</li><li>Obsahuje: Obsahuje pouzdro nebo kryt značky</li><li>Vodotěsnost: 3 atm</li><li>Sklo: Minerál</li><li>Typ pohybu: Kř",Pop Pulse Emporium,https://cdnbigbuy.com/images/6740452723167_S72118274_P00.jpg,https://cdnbigbuy.com/images/117286_mandatory-watch0.jpg,,,4349.3,5,NEW,14.16,11.56,10.0,0.33,1636.9,CZK,2,5,3
S5632719,6941921149437,cs-CZ,Gardening & DIY,Powerbank Hyper HJ3320WHGL Bílý,"Pokud se zajímáte o <b>počítače a elektronika</b>, rádi máte doma moderní vybavení a hlídáte si každý detail, kupte si <b>Powerbank Hyper HJ3320WHGL B","Pokud se zajímáte o <b>počítače a elektronika</b>, rádi máte doma moderní vybavení a hlídáte si každý detail, kupte si <b>Powerbank Hyper HJ3320WHGL Bílý</b> za nejlepší ceny.<br><br><p>Powerbank Hyper představuje praktické a efektivní řešení pro nabíjení mobilních zařízení, navržené v elegantní bílé barvě, která dodává moderní a čistý vzhled. Zařízení nabízí vstup i výstup přes USB-C, což zajišťuje širokou kompatibilitu s většinou současných smartphonů, tabletů a příslušenství, a zároveň umožňu",Pop Pulse Emporium,https://cdnbigbuy.com/images/6941921149437_S5632719_P00.jpg,https://cdnbigbuy.com/images/6941921149437_I00.jpg,https://cdnbigbuy.com/images/6941921149437_R00.jpg,,3481.82,2,NEW,12.0,8.0,19.0,0.32,1824.0,CZK,2,5,3
S55301978,0810157343659,cs-CZ,Gardening & DIY,Bezpečnostní kamera Compulocks 150B,"Pokud hledáte nejnovější trendy na trhu, máme tu čest vám představit <b>Bezpečnostní kamera Compulocks 150B</b>!<br><br><ul><li>Typ: Videokamera</li><","Pokud hledáte nejnovější trendy na trhu, máme tu čest vám představit <b>Bezpečnostní kamera Compulocks 150B</b>!<br><br><ul><li>Typ: Videokamera</li></ul>",Pop Pulse Emporium,https://cdnbigbuy.com/images/0810157343659_S55301978_P00.jpg,https://cdnbigbuy.com/images/0810157343659_S55301978_P10.jpg,https://cdnbigbuy.com/images/0810157343659_S55301978_P20.jpg,https://cdnbigbuy.com/images/0810157343659_I00.jpg,4144.9,25,NEW,17.74,15.61,15.36,0.71,4253.51,CZK,2,5,3
S72125653,0726644106877,cs-CZ,Gardening & DIY,Unisex sluneční brýle Serengeti SS555001,"Pokud hledáte nejnovější trendy na trhu, máme tu čest vám představit <b>Unisex sluneční brýle Serengeti SS555001</b>!<br><br><ul><li>Typ: Unisex slune","Pokud hledáte nejnovější trendy na trhu, máme tu čest vám představit <b>Unisex sluneční brýle Serengeti SS555001</b>!<br><br><ul><li>Typ: Unisex sluneční brýle</li><li>ochrana: 100% ochrana proti UV záření (UV400)</li><li>Pohlaví: Unisex</li></ul>",Pop Pulse Emporium,https://cdnbigbuy.com/images/0726644106877_S72125653_P00.jpg,https://cdnbigbuy.com/images/0726644106877_S72125653_P10.jpg,https://cdnbigbuy.com/images/0726644106877_S72125653_P20.jpg,,4473.01,25,NEW,10.0,9.54,10.2,0.23,973.08,CZK,2,5,3
S3723118,4038373002235,cs-CZ,Gardening & DIY,"Rázový klíč, rázový utahovák FORMULA 1 IW220 220 nm 2600 - 3300 rpm 20 V",Vybavte svůj vůz posledními produkty průmyslu! Kupte <b>Impact spanner FORMULA 1 IW220 220 nm 2600 - 3300 rpm 20 V</b> a už o nic nepřijdete!<br><ul><,"Vybavte svůj vůz posledními produkty průmyslu! Kupte <b>Impact spanner FORMULA 1 IW220 220 nm 2600 - 3300 rpm 20 V</b> a už o nic nepřijdete!<br><ul><li>velikost: 1/2""</li><li>Vlastnosti: <ul><li>Ergonomický</li><li>Protiskluzový</li></ul></li><li>Napětí: 20 V</li><li>Kompatibilní: <ul><li>LB200 - LB400</li><li>BC400</li></ul></li><li>Příkon: 220 nm</li><li>Rychlost: 2600 - 3300 rpm</li><li>Obsahuje: Klíč gola, ráčnový klíč 17/19/21/22 mm</li><li>Není zahrnut: Baterie</li></ul>",Pop Pulse Emporium,https://cdnbigbuy.com/images/4038373002235_S3723118_P02.jpg,https://cdnbigbuy.com/images/4038373002235_S3723118_P12.jpg,,,4008.63,4,NEW,30.0,10.0,21.0,2.0,6300.0,CZK,2,5,3
